{
  "schema_version": 1,
  "standard": "CCSDS 503.0-B-2",
  "package": "tdm",
  "source": "CCSDS 503.0-B-2 annex E",
  "note": "Tracking Data Message. The example is shipped as a readable .kvn file under corpus and carried here as a decode vector, hex-encoded because that is the only input form the schema has. What the vector asserts is the metadata that decides how a measurement must be read, and the record counts. The measurements themselves are floats, which a vector field cannot hold, and they are checked in pkg/tdm against the same published text. The range units matter most: this segment declares RU, nothing in a RANGE record says so, and reading 65249.677 as kilometres instead of range units is wrong by orders of magnitude.",
  "corpus": [
    "tdm/two-way-range.kvn"
  ],
  "decode": [
    {
      "name": "two-way-range-with-pr-n0",
      "clause": "E",
      "note": "Figure E-19, trimmed to three epochs: two-way sequential range from DSS-14 to Cassini, with ranging power to spectral density. RANGE_UNITS is RU and RANGE_MODULUS is non-zero, so clause 3.5.2.7 makes the range both ambiguous and not in kilometres \u2014 two facts a reader can only get from the metadata.",
      "config": {
        "structure": "tdm"
      },
      "input": "43435344535f54444d5f56455253203d20322e300a434f4d4d454e542043524541544544204259205454432050474d205633332e302e320a4352454154494f4e5f44415445203d20323031302d3035305432303a31353a30322e3030300a4f524947494e41544f52203d204e4153412f4a504c2f44534e0a0a4d4554415f53544152540a434f4d4d454e542053455155454e5449414c2052414e47450a434f4d4d454e542052414e47452049532041444a555354454420464f5220434f5252454354494f4e5f52414e47453b204d4541535552454d454e54204d494e555320434f5252454354494f4e5f52414e47450a54494d455f53595354454d203d205554430a53544152545f54494d45203d20323031302d3231355432303a30343a32342e3030300a53544f505f54494d45203d20323031302d3231355432303a35333a32342e3030300a5041525449434950414e545f31203d204453532d31340a5041525449434950414e545f32203d204341530a4d4f4445203d2053455155454e5449414c0a50415448203d20312c322c310a5452414e534d49545f42414e44203d20580a524543454956455f42414e44203d20580a5455524e41524f554e445f4e554d455241544f52203d203838300a5455524e41524f554e445f44454e4f4d494e41544f52203d203734390a54494d455441475f524546203d20524543454956450a494e544547524154494f4e5f524546203d2053544152540a52414e47455f4d4f4445203d20434f484552454e540a52414e47455f4d4f44554c5553203d203236323134340a52414e47455f554e495453203d2052550a5452414e534d49545f44454c41595f31203d20322e31452d30370a524543454956455f44454c41595f31203d20322e31452d30370a444154415f5155414c495459203d2056414c4944415445440a434f5252454354494f4e5f52414e4745203d20343939392e3339323731340a434f5252454354494f4e535f4150504c494544203d205945530a4d4554415f53544f500a0a444154415f53544152540a52414e4745203d20323031302d3231355432303a30343a32342e30303020202036353234392e363737313933313633310a50525f4e30203d20323031302d3231355432303a30343a32342e30303020202033302e323335310a52414e4745203d20323031302d3231355432303a31313a32342e30303020202035323233342e343735333837373530380a50525f4e30203d20323031302d3231355432303a31313a32342e30303020202033322e373834360a52414e4745203d20323031302d3231355432303a35333a32342e30303020202036343435372e303237303837393436310a50525f4e30203d20323031302d3231355432303a35333a32342e30303020202033302e303232340a444154415f53544f500a",
      "fields": {
        "version": "2.0",
        "originator": "NASA/JPL/DSN",
        "creation_date": "2010-02-19T20:15:02Z",
        "segment_count": 1,
        "observation_count": 6,
        "time_system": "UTC",
        "participant_1": "DSS-14",
        "participant_2": "CAS",
        "mode": "SEQUENTIAL",
        "path": "1,2,1",
        "range_units": "RU",
        "range_units_given": true,
        "range_modulus_given": true,
        "metadata_field_count": 21,
        "first_keyword": "RANGE",
        "first_epoch": "2010-08-03T20:04:24Z"
      }
    }
  ]
}
