{
  "schema_version": 1,
  "standard": "CCSDS 121.0-B-3",
  "package": "ldc",
  "source": "the published CCSDS 121.0 test data set, referenced by path and not transcribed",
  "note": "The 121.0 lossless compression corpus, 107 files across AllOptions and LowEntropyOptions. These are genuine published CCSDS test vectors, so they are referenced where they lie rather than transcribed into JSON: re-encoding would add nothing and risk transcription error. A consumer runs each .rz file through its decompressor and compares against the matching uncompressed input.",
  "corpus": [
    "ldc/corpus/AllOptions/test_p256n01-basic.rz",
    "ldc/corpus/AllOptions/test_p256n01-restricted.rz",
    "ldc/corpus/AllOptions/test_p256n01.dat",
    "ldc/corpus/AllOptions/test_p256n02-basic.rz",
    "ldc/corpus/AllOptions/test_p256n02-restricted.rz",
    "ldc/corpus/AllOptions/test_p256n02.dat",
    "ldc/corpus/AllOptions/test_p256n03-basic.rz",
    "ldc/corpus/AllOptions/test_p256n03-restricted.rz",
    "ldc/corpus/AllOptions/test_p256n03.dat",
    "ldc/corpus/AllOptions/test_p256n04-basic.rz",
    "ldc/corpus/AllOptions/test_p256n04-restricted.rz",
    "ldc/corpus/AllOptions/test_p256n04.dat",
    "ldc/corpus/AllOptions/test_p256n05.dat",
    "ldc/corpus/AllOptions/test_p256n05.rz",
    "ldc/corpus/AllOptions/test_p256n06.dat",
    "ldc/corpus/AllOptions/test_p256n06.rz",
    "ldc/corpus/AllOptions/test_p256n07.dat",
    "ldc/corpus/AllOptions/test_p256n07.rz",
    "ldc/corpus/AllOptions/test_p256n08.dat",
    "ldc/corpus/AllOptions/test_p256n08.rz",
    "ldc/corpus/AllOptions/test_p256n09.dat",
    "ldc/corpus/AllOptions/test_p256n09.rz",
    "ldc/corpus/AllOptions/test_p256n10.dat",
    "ldc/corpus/AllOptions/test_p256n10.rz",
    "ldc/corpus/AllOptions/test_p256n11.dat",
    "ldc/corpus/AllOptions/test_p256n11.rz",
    "ldc/corpus/AllOptions/test_p256n12.dat",
    "ldc/corpus/AllOptions/test_p256n12.rz",
    "ldc/corpus/AllOptions/test_p256n13.dat",
    "ldc/corpus/AllOptions/test_p256n13.rz",
    "ldc/corpus/AllOptions/test_p256n14.dat",
    "ldc/corpus/AllOptions/test_p256n14.rz",
    "ldc/corpus/AllOptions/test_p256n15.dat",
    "ldc/corpus/AllOptions/test_p256n15.rz",
    "ldc/corpus/AllOptions/test_p256n16.dat",
    "ldc/corpus/AllOptions/test_p256n16.rz",
    "ldc/corpus/AllOptions/test_p512n17.dat",
    "ldc/corpus/AllOptions/test_p512n17.rz",
    "ldc/corpus/AllOptions/test_p512n18.dat",
    "ldc/corpus/AllOptions/test_p512n18.rz",
    "ldc/corpus/AllOptions/test_p512n19.dat",
    "ldc/corpus/AllOptions/test_p512n19.rz",
    "ldc/corpus/AllOptions/test_p512n20.dat",
    "ldc/corpus/AllOptions/test_p512n20.rz",
    "ldc/corpus/AllOptions/test_p512n21.dat",
    "ldc/corpus/AllOptions/test_p512n21.rz",
    "ldc/corpus/AllOptions/test_p512n22.dat",
    "ldc/corpus/AllOptions/test_p512n22.rz",
    "ldc/corpus/AllOptions/test_p512n23.dat",
    "ldc/corpus/AllOptions/test_p512n23.rz",
    "ldc/corpus/AllOptions/test_p512n24.dat",
    "ldc/corpus/AllOptions/test_p512n24.rz",
    "ldc/corpus/AllOptions/test_p512n25.dat",
    "ldc/corpus/AllOptions/test_p512n25.rz",
    "ldc/corpus/AllOptions/test_p512n26.dat",
    "ldc/corpus/AllOptions/test_p512n26.rz",
    "ldc/corpus/AllOptions/test_p512n27.dat",
    "ldc/corpus/AllOptions/test_p512n27.rz",
    "ldc/corpus/AllOptions/test_p512n28.dat",
    "ldc/corpus/AllOptions/test_p512n28.rz",
    "ldc/corpus/AllOptions/test_p512n29.dat",
    "ldc/corpus/AllOptions/test_p512n29.rz",
    "ldc/corpus/AllOptions/test_p512n30.dat",
    "ldc/corpus/AllOptions/test_p512n30.rz",
    "ldc/corpus/AllOptions/test_p512n31.dat",
    "ldc/corpus/AllOptions/test_p512n31.rz",
    "ldc/corpus/AllOptions/test_p512n32.dat",
    "ldc/corpus/AllOptions/test_p512n32.rz",
    "ldc/corpus/LowEntropyOptions/Lowset1_8bit.dat",
    "ldc/corpus/LowEntropyOptions/Lowset1_8bit.n01-basic.rz",
    "ldc/corpus/LowEntropyOptions/Lowset1_8bit.n01-restricted.rz",
    "ldc/corpus/LowEntropyOptions/Lowset1_8bit.n02-basic.rz",
    "ldc/corpus/LowEntropyOptions/Lowset1_8bit.n02-restricted.rz",
    "ldc/corpus/LowEntropyOptions/Lowset1_8bit.n03-basic.rz",
    "ldc/corpus/LowEntropyOptions/Lowset1_8bit.n03-restricted.rz",
    "ldc/corpus/LowEntropyOptions/Lowset1_8bit.n04-basic.rz",
    "ldc/corpus/LowEntropyOptions/Lowset1_8bit.n04-restricted.rz",
    "ldc/corpus/LowEntropyOptions/Lowset1_8bit.n05.rz",
    "ldc/corpus/LowEntropyOptions/Lowset1_8bit.n06.rz",
    "ldc/corpus/LowEntropyOptions/Lowset1_8bit.n07.rz",
    "ldc/corpus/LowEntropyOptions/Lowset1_8bit.n08.rz",
    "ldc/corpus/LowEntropyOptions/Lowset2_8bit.dat",
    "ldc/corpus/LowEntropyOptions/Lowset2_8bit.n01-basic.rz",
    "ldc/corpus/LowEntropyOptions/Lowset2_8bit.n01-restricted.rz",
    "ldc/corpus/LowEntropyOptions/Lowset2_8bit.n02-basic.rz",
    "ldc/corpus/LowEntropyOptions/Lowset2_8bit.n02-restricted.rz",
    "ldc/corpus/LowEntropyOptions/Lowset2_8bit.n03-basic.rz",
    "ldc/corpus/LowEntropyOptions/Lowset2_8bit.n03-restricted.rz",
    "ldc/corpus/LowEntropyOptions/Lowset2_8bit.n04-basic.rz",
    "ldc/corpus/LowEntropyOptions/Lowset2_8bit.n04-restricted.rz",
    "ldc/corpus/LowEntropyOptions/Lowset2_8bit.n05.rz",
    "ldc/corpus/LowEntropyOptions/Lowset2_8bit.n06.rz",
    "ldc/corpus/LowEntropyOptions/Lowset2_8bit.n07.rz",
    "ldc/corpus/LowEntropyOptions/Lowset2_8bit.n08.rz",
    "ldc/corpus/LowEntropyOptions/Lowset3_8bit.dat",
    "ldc/corpus/LowEntropyOptions/Lowset3_8bit.n01-basic.rz",
    "ldc/corpus/LowEntropyOptions/Lowset3_8bit.n01-restricted.rz",
    "ldc/corpus/LowEntropyOptions/Lowset3_8bit.n02-basic.rz",
    "ldc/corpus/LowEntropyOptions/Lowset3_8bit.n02-restricted.rz",
    "ldc/corpus/LowEntropyOptions/Lowset3_8bit.n03-basic.rz",
    "ldc/corpus/LowEntropyOptions/Lowset3_8bit.n03-restricted.rz",
    "ldc/corpus/LowEntropyOptions/Lowset3_8bit.n04-basic.rz",
    "ldc/corpus/LowEntropyOptions/Lowset3_8bit.n04-restricted.rz",
    "ldc/corpus/LowEntropyOptions/Lowset3_8bit.n05.rz",
    "ldc/corpus/LowEntropyOptions/Lowset3_8bit.n06.rz",
    "ldc/corpus/LowEntropyOptions/Lowset3_8bit.n07.rz",
    "ldc/corpus/LowEntropyOptions/Lowset3_8bit.n08.rz"
  ]
}
