{
  "schema_version": 1,
  "standard": "CCSDS 504.0-B-2",
  "package": "adm",
  "source": "CCSDS 504.0-B-2 annex G",
  "note": "Attitude Data Messages. The examples are shipped as readable .kvn files under corpus and carried here as decode vectors, hex-encoded because that is the only input form the schema has. Two of the three messages are covered: the APM and the AEM. The ACM of section 5 is not implemented, for the same reason the ODM's OCM is not \u2014 it is roughly three times the size of the other two together, arrived with the 2024 issue, and adoption is thin. What the vectors assert is which blocks a message carried, the frames a rotation goes between, and for an AEM the attitude type and the resulting line width. The numbers are floats, which a vector field cannot hold, and are checked in pkg/adm against the same published text.",
  "corpus": [
    "adm/apm-quaternion.kvn",
    "adm/apm-blocks.kvn",
    "adm/aem-quaternion.kvn"
  ],
  "decode": [
    {
      "name": "apm-quaternion-only",
      "clause": "G1",
      "note": "Figure G-1, the simplest APM: a quaternion and nothing else. The scalar component is QC and it comes last on the wire, after the vector part \u2014 the opposite of what many quaternion libraries expect.",
      "config": {
        "structure": "apm"
      },
      "input": "43435344535f41504d5f56455253203d20322e300a4352454154494f4e5f44415445203d20323030332d30392d33305431393a32333a35370a4f524947494e41544f52203d20475346430a0a4f424a4543545f4e414d452020203d2054524d4d0a4f424a4543545f494420202020203d20313939372d303632410a43454e5445525f4e414d452020203d2045415254480a54494d455f53595354454d2020203d205554430a0a434f4d4d454e542020202020202043757272656e7420617474697475646520666f72206f72626974203333350a434f4d4d454e54202020202020204174746974756465207374617465207175617465726e696f6e0a434f4d4d454e54202020202020204163637572616379206f66207468697320617474697475646520697320302e303220646567205253532e0a0a45504f434820202020203d20323030332d30392d33305431343a32383a31352e313137320a0a515541545f53544152540a5245465f4652414d455f41202020203d2053435f424f44595f310a5245465f4652414d455f42202020203d2049545246313939370a0a513120202020202020203d20302e30303030350a513220202020202020203d20302e38373534330a513320202020202020203d20302e34303934390a514320202020202020203d20302e32353637380a515541545f53544f500a",
      "fields": {
        "version": "2.0",
        "originator": "GSFC",
        "creation_date": "2003-09-30T19:23:57Z",
        "object_name": "TRMM",
        "object_id": "1997-062A",
        "time_system": "UTC",
        "epoch": "2003-09-30T14:28:15.1172Z",
        "has_quaternion": true,
        "has_euler": false,
        "has_angvel": false,
        "has_spin": false,
        "has_inertia": false,
        "maneuver_count": 0,
        "frame_a": "SC_BODY_1",
        "frame_b": "ITRF1997"
      }
    },
    {
      "name": "apm-euler-inertia-maneuver",
      "clause": "G1",
      "note": "Figure G-3, trimmed: Euler angles with their rotation sequence, an inertia tensor and one planned maneuver, with units written on most values as clause 6.6 allows. EULER_ROT_SEQ is what makes three angles a rotation.",
      "config": {
        "structure": "apm"
      },
      "input": "43435344535f41504d5f56455253203d20322e300a4352454154494f4e5f44415445203d20323030362d30332d31335431333a31333a33330a4f524947494e41544f5220202020203d20475346430a4d4553534147455f494420202020203d2041373031355a320a0a4f424a4543545f4e414d452020203d20474f45532d500a4f424a4543545f494420202020203d20323030362d303033410a43454e5445525f4e414d452020203d2045415254480a54494d455f53595354454d2020203d205554430a0a434f4d4d454e5420417474697475646520676976656e2062792045756c657220616e676c65730a0a45504f4348203d20323030362d30332d31325430393a35363a33392e343938370a0a45554c45525f53544152540a434f4d4d454e542045756c657220616e676c65730a5245465f4652414d455f412020203d20424f44595f4652414d455f410a5245465f4652414d455f422020203d2049545246313939370a45554c45525f524f545f534551203d205958590a414e474c455f31202020203d202d32362e3738205b6465675d0a414e474c455f32202020203d20332e3731205b6465675d0a414e474c455f33202020203d202d31312e3136205b6465675d0a45554c45525f53544f500a0a494e45525449415f53544152540a494e45525449415f5245465f4652414d45203d2053435f424f44595f310a495858202020202020203d20363038302e30205b6b672a6d2a2a325d0a495959202020202020203d20353234352e35205b6b672a6d2a2a325d0a495a5a202020202020203d20383036372e33205b6b672a6d2a2a325d0a495859202020202020203d202d3133352e39205b6b672a6d2a2a325d0a49585a202020202020203d2038392e332020205b6b672a6d2a2a325d0a49595a202020202020203d202d39302e37205b6b672a6d2a2a325d0a494e45525449415f53544f500a0a4d414e5f53544152540a434f4d4d454e54204461746120666f6c6c6f777320666f72203120706c616e6e6564206d616e65757665722e0a434f4d4d454e5420496d70756c736976652c20746f7271756520646972656374696f6e20666978656420696e20626f6479206672616d650a4d414e5f45504f43485f5354415254203d20323030342d30322d31345431343a32393a30302e353039380a4d414e5f4455524154494f4e203d203320202020205b735d0a4d414e5f5245465f4652414d45203d20494352460a4d414e5f544f525f5820202020203d202d312e3235205b4e2a6d5d0a4d414e5f544f525f5920202020203d202d302e352020205b4e2a6d5d0a4d414e5f544f525f5a20202020203d20302e352020205b4e2a6d5d0a4d414e5f53544f500a",
      "fields": {
        "version": "2.0",
        "originator": "GSFC",
        "creation_date": "2006-03-13T13:13:33Z",
        "object_name": "GOES-P",
        "object_id": "2006-003A",
        "time_system": "UTC",
        "epoch": "2006-03-12T09:56:39.4987Z",
        "has_quaternion": false,
        "has_euler": true,
        "has_angvel": false,
        "has_spin": false,
        "has_inertia": true,
        "maneuver_count": 1,
        "frame_a": "BODY_FRAME_A",
        "frame_b": "ITRF1997",
        "euler_rot_seq": "YXY"
      }
    },
    {
      "name": "aem-quaternion-two-blocks",
      "clause": "G2",
      "note": "Figure G-4, with the omitted records left out. Two metadata groups, the second beginning after a trajectory correction maneuver. ATTITUDE_TYPE is QUATERNION, which table 4-4 makes four values after the epoch; nothing in a data line says that, which is why the vector records both the type and the width.",
      "config": {
        "structure": "aem"
      },
      "input": "43435344535f41454d5f56455253203d20322e300a4352454154494f4e5f44415445203d20323030322d31312d30345431373a32323a33310a4f524947494e41544f52203d204e4153412f4a504c0a4d4553534147455f4944203d2041373031355a330a0a4d4554415f53544152540a434f4d4d454e5420546869732066696c65207761732070726f6475636564206279204d2e522e20536f6d65626f64792c204d534f4f204e41562f4a504c2e0a434f4d4d454e5420497420697320746f206265207573656420666f72206174746974756465207265636f6e737472756374696f6e206f6e6c792e0a4f424a4543545f4e414d4520202020203d204d41525320474c4f42414c205355525645594f520a4f424a4543545f49442020202020203d20313939362d303632410a43454e5445525f4e414d4520202020203d204d415253204241525943454e5445520a5245465f4652414d455f4120202020203d20454d45323030300a5245465f4652414d455f4220202020203d2053435f424f44595f310a54494d455f53595354454d20202020203d205554430a53544152545f54494d452020202020203d20313939362d31312d32385432313a32393a30372e323535350a55534541424c455f53544152545f54494d45203d20313939362d31312d32385432323a30383a30322e353535350a55534541424c455f53544f505f54494d45203d20313939362d31312d33305430313a31383a30322e353535350a53544f505f54494d452020202020203d20313939362d31312d33305430313a32383a30322e353535350a41545449545544455f54595045202020203d205155415445524e494f4e0a494e544552504f4c4154494f4e5f4d4554484f44203d206865726d6974650a494e544552504f4c4154494f4e5f444547524545203d20370a4d4554415f53544f500a0a444154415f53544152540a313939362d31312d32385432313a32393a30372e3235353520302e353637343820302e303331343620302e343536383920302e36383432370a313939362d31312d32385432323a30383a30332e3535353520302e3432333139202d302e343536393720302e323337383420302e37343533330a313939362d31312d33305430313a32383a30322e3535353520302e3734353633202d302e343533373520302e333638373520302e33313936340a444154415f53544f500a0a4d4554415f53544152540a434f4d4d454e54205468697320626c6f636b20626567696e73206166746572207472616a6563746f727920636f7272656374696f6e206d616e65757665722054434d2d332e0a4f424a4543545f4e414d4520202020203d206d61727320676c6f62616c207375727665796f720a4f424a4543545f49442020202020203d20313939362d303632410a43454e5445525f4e414d4520202020203d204d415253204241525943454e5445520a5245465f4652414d455f4120202020203d20454d45323030300a5245465f4652414d455f42202020202020203d2053435f424f44595f310a54494d455f53595354454d20202020203d205554430a53544152545f54494d452020202020203d20313939362d31322d31385431323a30353a30302e353535350a53544f505f54494d452020202020203d20313939362d31322d32385432313a32383a30302e353535350a41545449545544455f54595045202020203d205155415445524e494f4e0a4d4554415f53544f500a0a444154415f53544152540a313939362d31322d31385431323a30353a30302e3535353520302e3732353031202d302e363435383520302e30313835343220302e32333835340a444154415f53544f500a",
      "fields": {
        "version": "2.0",
        "originator": "NASA/JPL",
        "message_id": "A7015Z3",
        "creation_date": "2002-11-04T17:22:31Z",
        "object_name": "MARS GLOBAL SURVEYOR",
        "object_id": "1996-062A",
        "center_name": "MARS BARYCENTER",
        "frame_a": "EME2000",
        "frame_b": "SC_BODY_1",
        "time_system": "UTC",
        "attitude_type": "QUATERNION",
        "values_per_line": 4,
        "block_count": 2,
        "record_count": 4,
        "interpolation_method": "hermite",
        "interpolation_degree": 7
      }
    }
  ]
}
